{
  "$schema": "./quality-baseline.schema.json",
  "schemaVersion": 1,
  "coverage": {
    "statements": 72,
    "branches": 59,
    "functions": 77,
    "lines": 73
  },
  "lint": {
    "total": 52,
    "areas": {
      "media": 52,
      "packages": 0,
      "extensions": 0
    }
  },
  "largeModuleLineLimit": 800,
  "changedHighRiskCoverage": {
    "lines": 80,
    "branches": 70,
    "roots": [
      "src/activation/",
      "src/commands/importCommands.ts",
      "src/contracts/",
      "src/core/queryCancellation.ts",
      "src/core/queryRunner.ts",
      "src/core/streaming/",
      "src/export/",
      "src/import/",
      "src/migration/",
      "src/state/",
      "src/views/",
      "media/",
      "packages/ui-core/",
      "packages/ui-react/"
    ]
  }
}
